{
  "enginePowerLinear" : 2000000.0,
  "enginePowerLinearMin" : 10000.0,
  "enginePowerAngular" : 1.0,
  "enginePowerAngularMin" : 0.0,
  "engineHeatLoss" : 0.01,
  "engineHeatGain" : 0.03,
  "engineHeatChangeExponent" : 0.1,
  "engineRedstoneBehaviorPause" : false,
  "engineFuelSaving" : false,
  "engineMinCapacity" : 2000,
  "engineFuelMultiplier" : 2.0,
  "maxCasualSpeed" : 15.0,
  "stabilizationSpeed" : 10.0,
  "floaterBuoyantFactorPerKg" : 50000.0,
  "maxFloaterBuoyantFactor" : 1.0,
  "baseSpeed" : 3.0,
  "baseImpulseElevationRate" : 2.0,
  "balloonElevationMaxSpeed" : 5.5,
  "elevationSnappiness" : 1.0,
  "doFluidDrag" : false,
  "massPerBalloon" : 5000.0,
  "turnSpeed" : 3.0,
  "turnAcceleration" : 10.0,
  "maxSizeForTurnSpeedPenalty" : 16.0,
  "stabilizationTorqueConstant" : 15.0,
  "linearStabilizeMaxAntiVelocity" : 1.0,
  "antiVelocityMassRelevance" : 0.8,
  "popSideBalloonChance" : 0.3,
  "blockBlacklist" : [ "vs_eureka:ship_helm", "minecraft:dirt", "minecraft:grass_block", "minecraft:grass_path", "minecraft:stone", "minecraft:bedrock", "minecraft:sand", "minecraft:gravel", "minecraft:water", "minecraft:flowing_water", "minecraft:lava", "minecraft:flowing_lava", "minecraft:lily_pad", "minecraft:coarse_dirt", "minecraft:podzol", "minecraft:granite", "minecraft:diorite", "minecraft:andesite", "minecraft:deepslate", "minecraft:tuff", "minecraft:crimson_nylium", "minecraft:warped_nylium", "minecraft:red_sand", "minecraft:sandstone", "minecraft:end_stone", "minecraft:red_sandstone", "minecraft:blackstone", "minecraft:netherrack", "minecraft:soul_sand", "minecraft:soul_soil", "minecraft:grass", "minecraft:fern", "minecraft:dead_bush", "minecraft:seagrass", "minecraft:tall_seagrass", "minecraft:sea_pickle", "minecraft:kelp", "minecraft:bamboo", "minecraft:dandelion", "minecraft:poppy", "minecraft:blue_orchid", "minecraft:allium", "minecraft:azure_bluet", "minecraft:red_tulip", "minecraft:orange_tulip", "minecraft:white_tulip", "minecraft:pink_tulip", "minecraft:oxeye_daisy", "minecraft:cornflower", "minecraft:lily_of_the_valley", "minecraft:brown_mushroom", "minecraft:red_mushroom", "minecraft:crimson_fungus", "minecraft:warped_fungus", "minecraft:crimson_roots", "minecraft:warped_roots", "minecraft:nether_sprouts", "minecraft:weeping_vines", "minecraft:twisting_vines", "minecraft:chorus_plant", "minecraft:chorus_flower", "minecraft:snow", "minecraft:snow_block", "minecraft:cactus", "minecraft:vine", "minecraft:sunflower", "minecraft:lilac", "minecraft:rose_bush", "minecraft:peony", "minecraft:tall_grass", "minecraft:large_fern", "minecraft:air", "minecraft:ice", "minecraft:packed_ice", "minecraft:blue_ice", "minecraft:portal", "minecraft:end_portal_frame", "minecraft:end_portal", "minecraft:end_gateway", "minecraft:oak_sapling", "minecraft:spruce_sapling", "minecraft:birch_sapling", "minecraft:jungle_sapling", "minecraft:acacia_sapling", "minecraft:dark_oak_sapling", "minecraft:oak_leaves", "minecraft:spruce_leaves", "minecraft:birch_leaves", "minecraft:jungle_leaves", "minecraft:acacia_leaves", "minecraft:dark_oak_leaves" ],
  "diagonals" : true,
  "ballastWeight" : 10000.0,
  "ballastNoWeight" : 1000.0,
  "allowDisassembly" : true,
  "maxShipBlocks" : 32768,
  "$schema" : "schemas/vs_eureka_server.schema.json"
}